<?xml version="1.0" encoding="UTF-8"?>
<!--
To change this license header, choose License Headers in Project Properties.
To change this template file, choose Tools | Templates
and open the template in the editor.
-->


<ns1:websiteCategory
    xmlns:xsi='http://www.w3.org/2001/XMLSchema-instance'
    xmlns:ns1='http://xml.netbeans.org/schema/websiteCategory'
    xsi:schemaLocation='http://xml.netbeans.org/schema/websiteCategory websiteCategory.xsd'>
    <ns1:id></ns1:id>
    <ns1:name></ns1:name>
    <ns1:url></ns1:url>
    <ns1:website></ns1:website>
    <ns1:category>
        <ns1:id></ns1:id>
        <ns1:name></ns1:name>
        <ns1:levelAuth></ns1:levelAuth>
    </ns1:category>

</ns1:websiteCategory>
